{
  "schema": "https://organchor.org/schemas/s3-sample-event.v1.json",
  "type": "OrgAnchorS3SampleEvent",
  "version": "1.0",
  "sample_event_id": "s3-event-2026-001",
  "created_at": "2026-05-30T00:00:00Z",
  "subject": {
    "subject_type": "product_model",
    "subject_id": "model-x1",
    "batch_id": "batch-2026-05"
  },
  "claim_binding": {
    "claim_id": "claim-001",
    "claim_version": "2026-05",
    "sample_pool_id": "s3-pool-claim-001-2026-05"
  },
  "sample_slot_id": "sample-slot-claim-001-2026-05-001",
  "sample_slot": {
    "sample_slot_id": "sample-slot-claim-001-2026-05-001",
    "sample_pool_id": "s3-pool-claim-001-2026-05",
    "slot_status": "ISSUED_OR_RESERVED",
    "slot_verification_status": "NOT_VERIFIED_BY_ALPHA_TOOLING"
  },
  "credential_binding": {
    "credential_type": "OrgAnchorProductUnitCredential",
    "credential_hash": "sha256:9999999999999999999999999999999999999999999999999999999999999999",
    "issuer_delegated_key_id": "product-key-2026",
    "credential_verified_against_root": true,
    "sample_nullifier": "sha256:8888888888888888888888888888888888888888888888888888888888888888"
  },
  "submitter": {
    "submitter_type": "buyer_agent",
    "name": "Example Buyer Agent",
    "origin": "https://buyer.example"
  },
  "acquisition": {
    "sample_type": "market_purchase",
    "acquired_at": "2026-05-20T10:00:00Z",
    "sample_source": "retail_market",
    "selected_by": "buyer_agent",
    "organization_provided_sample": false,
    "sample_size": 1,
    "region": "EU",
    "channel": "retail"
  },
  "method": {
    "method_ref": "method-dimensional-check-001",
    "method_summary": "Public dimensional tolerance check using declared spec sheet."
  },
  "result": {
    "outcome": "PASS",
    "summary": "The sampled unit matched declared dimensional tolerance under the stated method.",
    "observed_at": "2026-05-21T09:00:00Z"
  },
  "raw_evidence": {
    "bundle_hash": "sha256:aaaaaaaaaaaaaaaaaaaaaaaaaaaaaaaaaaaaaaaaaaaaaaaaaaaaaaaaaaaaaaaa",
    "bundle_manifest_hash": "sha256:bbbbbbbbbbbbbbbbbbbbbbbbbbbbbbbbbbbbbbbbbbbbbbbbbbbbbbbbbbbbbbbb",
    "vaults": [
      {
        "vault_operator": "Example Directory",
        "vault_origin": "https://directory.example",
        "vault_independence": "directory_operator",
        "raw_availability_status": "AVAILABLE",
        "access_policy": "request_required",
        "raw_retention_until": "2026-12-31T00:00:00Z",
        "last_availability_check": "2026-05-30T00:00:00Z"
      }
    ]
  },
  "limitations": [
    "One sample does not prove all batches, regions, channels, or future production."
  ],
  "not_a_trust_decision": true
}
